{
  "early": true,
  "endedAtEpochMs": 1790000400000,
  "noReps": [
    {
      "setIndex": 0,
      "stepIndex": 1,
      "tMs": 1790000313500
    }
  ],
  "plan": {
    "division": "open_men",
    "raceTargetSeconds": 5400,
    "steps": [
      {
        "activity": "run",
        "index": 0,
        "reps": 1,
        "runNumber": 1,
        "sets": [],
        "targetSeconds": 300
      },
      {
        "activity": "wall_balls",
        "index": 1,
        "reps": 50,
        "runNumber": 2,
        "sets": [
          25,
          25
        ],
        "targetSeconds": 240
      }
    ],
    "transitionSeconds": 10,
    "type": "wall_ball_focus"
  },
  "repCorrection": -1,
  "repTimesMs": [
    1790000310000,
    1790000313000
  ],
  "splits": [
    {
      "endMs": 1790000300000,
      "startMs": 1790000000000,
      "stepIndex": 0
    },
    {
      "endMs": 1790000400000,
      "startMs": 1790000300000,
      "stepIndex": 1
    }
  ],
  "startedAtEpochMs": 1790000000000,
  "wallBallCorrection": {
    "noReps": 2,
    "validReps": 48
  }
}
